<?xml version="1.0" encoding="UTF-8"?>
<personalInfo xmlns="http://mthlpbs.github.io/config"
              xmlns:xsi="http://www.w3.org/2001/XMLSchema-instance"
              xsi:schemaLocation="http://mthlpbs.github.io/config ../config/info.xsd">
    
    <name>Mithila Prabashwara</name>
    <birth>2001-10-07</birth>
    <email>asuramanna.mithilaprabashwara@gmail.com</email>
    
    <location>
        <city>Mirigama</city>
        <country>Sri Lanka</country>
    </location>
    
    <title>SE Undergraduate</title>
    
    <social>
        <linkedin>https://www.linkedin.com/in/mithilaprabashwara/</linkedin>
        <github>https://github.com/mthlpbs/</github>
        <github>https://github.com/asurpbs/</github>
        <portfolio>https://mthlpbs.github.io/</portfolio>
    </social>
    
    <skills>
        <programmingLanguages>
            <skill>Python</skill>
            <skill>Java</skill>
            <skill>C</skill>
        </programmingLanguages>
        <webTechnologies>
            <skill>HTML5</skill>
            <skill>CSS3</skill>
        </webTechnologies>
        <databases>
            <skill>MongoDB</skill>
            <skill>MySQL</skill>
        </databases>
        <toolsPlatforms>
            <skill>Git</skill>
            <skill>Docker</skill>
            <skill>AWS</skill>
            <skill>Azure</skill>
        </toolsPlatforms>
        <other>
            <skill>UI/UX Design</skill>
        </other>
    </skills>
    
    <education>
        <education>
            <institution>Saegis Campus Nugegoda</institution>
            <degree>Bachelor of Science in Software Engineering</degree>
            <graduation>2027</graduation>
            <gpa>3.84/4.0 (Sophomore)</gpa>
        </education>
    </education>
    
    <projects>
        <project>
            <name>Library-Management-System</name>
            <description>Library Management System with a user-friendly graphical interface, offering all the essential features of a traditional Lib. management solution for small scale library</description>
            <technologies>
                <technology>Java</technology>
            </technologies>
            <github>https://github.com/mthlpbs/Library-Management-System</github>
        </project>
    </projects>
    
    <languages>
        <language>
            <language>Sinhala</language>
            <proficiency>Native</proficiency>
        </language>
        <language>
            <language>English</language>
            <proficiency>Intermediate</proficiency>
        </language>
    </languages>
    
    <interests>
        <interest>Open Source Development</interest>
        <interest>Machine Learning</interest>
        <interest>Artificial Intelligence</interest>
        <interest>Software Developing</interest>
        <interest>Reading Tech Blogs</interest>
    </interests>
    
    <availability>
        <status>Available for new opportunities</status>
        <preferredRoles>
            <role>ML Engineer</role>
            <role>Software Engineer</role>
        </preferredRoles>
        <workType>
            <type>Remote</type>
            <type>Hybrid</type>
            <type>On-site</type>
        </workType>
    </availability>
    
</personalInfo>
